specialty,link,question,answer
Cancer,https://www.maxhealthcare.in/our-specialities/cancer/faqs,Are there herbal products that can cure cancer?,"No. Although some studies suggest that alternative or complementary therapies, including some herbs, may help patients cope with the side effects of cancer treatment, no herbal products have been shown to be effective for treating cancer. In fact, some herbal products may be harmful when taken during chemotherapy or radiation therapy because they may interfere with how these treatments work. Cancer patients should talk with their doctor about any complementary and alternative medicine products—including vitamins and herbal supplements—they may be using."
Cancer,https://www.maxhealthcare.in/our-specialities/cancer/faqs,How to take care of yourself during the treatment?,"When your body tells you it is tired, listen to it. Rest, lie down during the day or go to bed early. • Choose carefully what you do when you are very tired. Having something to do that you enjoy can be a good distraction. Regular exercise, without overdoing it, may help prevent depression and tiredness. • Develop a plan to pace yourself. Space activities out over the week. Plan rest periods between activities. • While you are recovering from treatment give simple tasks, such as house work, to other people. Sometimes it can be difficult to accept help. Your family and friends appreciate being asked to help you with practical tasks such as shopping and cooking."
Cancer,https://www.maxhealthcare.in/our-specialities/cancer/faqs,"How to manage fear, anxiety and panic attacks?","If you have a panic attack: • Take slow deep breaths. • Distract yourself. For example go for a walk, ring a friend, or listen to music. • Do relaxation exercises."
Cancer,https://www.maxhealthcare.in/our-specialities/cancer/faqs,How to cope with the depression?,"Many people go through a time of grief and sadness when they first learn that they have cancer. They grieve the loss of health and certainty in their lives. This sadness may seem like depression, but it’s not the same. Grieving – feeling sadness, fear, anger, or going through crying spells – is a common reaction to learning you have cancer. It usually doesn’t last a long time, and is normal."
Cancer,https://www.maxhealthcare.in/our-specialities/cancer/faqs,Does radiotherapy causes hair loss from scalp/head?,"Patients receiving Radiotherapy - RT on their head lose their scalp hair (that too partially). If you are getting radiation on any other body part, you will not lose your scalp hair. Radiation causes only hair loss in local area. Patient receiving radiation to breast might lose some hair in arm pit or male patients with RT might lose facial/beard/moustache hair."
Cancer,https://www.maxhealthcare.in/our-specialities/cancer/faqs,How can I develop my behavioral skills to overcome the changes in the body image?,"Sometimes people may stare, make comments, ask questions or avoid people with body changes. This can be upsetting and hard to deal with. Social skills focus on how to communicate well and can help you manage social gatherings and the reactions of other people. You may wish to think about: • Presentation – The way you present yourself overall is important, for example, dress and accessories. It conveys a message to other people about how you feel about yourself. • Posture – Communication involves the whole body. Standing with your shoulders back and head up makes you look confident and assertive. • Engaging with people – Making eye contact, smiling and nodding tells others that you’re approachable. • Taking the initiative – You may wish to talk about your body changes at an appropriate point in a conversation. • Having self-confidence and believing in one self is of utmost importance."
Cancer,https://www.maxhealthcare.in/our-specialities/cancer/faqs,How can I manage the fear and anxiety I feel before my follow-up test or appointment?,"It’s normal to feel anxious before your follow-up tests and appointments, but there are ways to ease your mind. Tips and strategies • Writing down questions about any issues you are currently or have been experiencing — whether it’s long-standing symptoms, emotional aspects, or practical issues such as questions about health insurance — and • Asking a friend or family member to sit with you while you wait for your scans. • In the days before your appointments, schedule activities that can help distract you from worrying, such as going for walks, talking with friends and family, or doing a calming exercise like yoga. • Positive feedback by self : “ I am alright”. You may find that your anxiety lessens or disappears over time."
Cancer,https://www.maxhealthcare.in/our-specialities/cancer/faqs,What is follow-up cancer care and why is it important?,"• Follow-up cancer care involves regular medical checkups that include a review of a patient’s medical history and a physical exam. Follow-up care may include imaging procedures(X Rays, Utrasound, CT Scan, MRIs etc), blood tests, and other lab tests. • Follow-up care is important because it helps to identify changes in health. The purpose of follow-up care is to check for recurrence (the return of cancer in the primary site) or metastasis (the spread of cancer to another part of the body) or be sure that one is cancer free. • Follow-up care visits are also important to help in the prevention or early detection of other types of cancer, address ongoing problems due to cancer or its treatment, and check for physical effects that may develop months to years after treatment ends. All cancer survivors should have follow-up care."
Cancer,https://www.maxhealthcare.in/our-specialities/cancer/faqs,What actions can I take to improve my health after completing treatment for cancer?,"There are several important things you can to do safeguard your health. • Stop Smoking / Alcohol Quitting smoking is one of the best ways to improve your general health. Quitting will help you breathe easier and feel better overall. It will also reduce your risk of developing certain cancers and will help prevent cardiovascular disease. • Eat a Nutritious Diet Eating a nutrient-rich diet with plenty of fruits and vegetables can help you feel better and may lower your chances of developing other health problems. Our Eating Your Way to Better Health and Eating Well during and after Your Cancer Treatment guides offer general dietary guidance. • Achieve and Maintain a Healthy Weight After cancer treatment, speak with your healthcare provider about whether you need to gain or lose weight. • Exercise Regularly and management of weight. Exercise after cancer treatment, regardless of how active you were prior to your diagnosis, can improve cardiovascular fitness and muscle strength. Regular exercise may also reduce fatigue in some cancer survivors."
Cancer,https://www.maxhealthcare.in/our-specialities/cancer/faqs,Can nutrition prevent cancer?,"Our daily diet makes a huge difference in the functioning of our immune system. There are certain foods which strengthen the immune system of the human body and lower the risks of infections. It is a not an immensely difficult task to find a link between a good nutritious palate and the prevention of cancer. There are certain foods which do contribute to the prevention of cancer. Also, different foods have varied effects on the human body. Cancer can be prevented by good nutrition. • Focus on fruits and vegetables in the daily diet. • Include lots of fibers in the diet. This can be done by using brown bread instead of white bread and brown rice instead of white polished rice. • Avoid fried food and opt for natural food. • Cut down on processed food including red meat. • Prepare food healthily. Avoid cooking in high heat and use less oil. We must wash our food pretty well and use steam as a process to cook."
Cancer,https://www.maxhealthcare.in/our-specialities/cancer/faqs,How can Genetic Counselling help?,"The main intent for genetic counselling is to escalate the process of finding out disorders which are genetic in nature. Once one gets to know them, understanding them becomes easier. The sessions of counselling begin from this very point and are used to explain to the patient, the various management procedures for nullifying the disease. A genetic counselling session not only educates the patient of the origin of the disease but also explains the risk and the potential positive outcomes of all medical tests. The benefits of genetic counselling are: • Individualized and comprehensive counseling from cancer genetics experts, including medical oncologists trained in cancer genetics, Practiced nurses and board-certified genetic counselors and social workers. • Potential for discovering an increased risk of cancer. • Opportunity to learn about the benefits, risks, and limitations of genetic testing. • Option to undergo genetic testing, if appropriate. • Patients and their families can learn how to decrease their risk for developing cancer (screening or medical and surgical approaches)."
Obstetrics And Gynaecology,https://www.maxhealthcare.in/our-specialities/obstetrics-and-gynaecology/faqs,What all should I carry for my first appointment?,"Before meeting your gynecologist for the first time, here’s a checklist of items you should be carrying: 1. List of symptoms you’ve been having and its characteristics such as how long has it been, what does it entail, etc. 2. Any recent (<1 year) medical tests such as blood tests, urine tests, etc. 3. If you have any existing medical conditions, bring along your prescription and related medical information 4. Information about your family history 5. Your insurance details or company ID card, if the hospital is on your panel"
Obstetrics And Gynaecology,https://www.maxhealthcare.in/our-specialities/obstetrics-and-gynaecology/faqs,Can I travel during pregnancy?,"Unless you have been identified with any complications, it is perfectly safe to travel during pregnancy. Most women find the second trimester the most ideal time to travel as you are done with the morning sickness of the first trimester and won’t get as easily tired as one does in their third trimester. Indian airline carriers allow women to travel up to 32 weeks of their pregnancy."
Obstetrics And Gynaecology,https://www.maxhealthcare.in/our-specialities/obstetrics-and-gynaecology/faqs,How often should I get checked by my doctor during my pregnancy?,"In a normal pregnancy, you can be expected to come in for a check up on the following days: • 4 weeks to 28 weeks: 1 visit/month • 28 weeks to 36 weeks: 1 visit/2 weeks • 36 weeks to 40 weeks: 1 visit/week If it is a high-risk pregnancy such as twins, advanced age of women or a complicated pregnancy, your doctor may want to see you more often depending on your condition."
Obstetrics And Gynaecology,https://www.maxhealthcare.in/our-specialities/obstetrics-and-gynaecology/faqs,What should my diet be once I am pregnant?,"A pregnant woman needs more folic acid, calcium, iron & protein than a non-pregnant woman. Hence pre-natal vitamins, which contain an ideal amount is prescribed to every expecting woman. Leafy vegetables, whole grains, dairy products, fruits and lean meats should make up 80 % of the diet. There can be cravings for salty and sugary food in pregnancy but one should try to eat as healthily as possible to avoid gaining excess weight."
Obstetrics And Gynaecology,https://www.maxhealthcare.in/our-specialities/obstetrics-and-gynaecology/faqs,"""What changes do I expect in my body once I am pregnant?""","Your body will undergo a multitude of changes as you go through your pregnancy. The most obvious change is your abdomen. It will start looking globular by 12 weeks, an ovoid shape by 28 weeks and turns spherical beyond 36 weeks. The change in the shape of your abdomen is accompanied by slight discomfort, gastric reflux and stretch marks over the next 9 months. The breasts become larger and the areola becomes darker as the pregnancy advances. Your skin may undergo changes such as stretch marks on your buttocks, thighs and abdomen in the second half of pregnancy. Hyperpigmentation of the umbilicus, nipples, abdominal midline & face may be seen due to the hormonal changes in pregnancy. Spider veins and reddening of the palms is commonly seen due to hyperdynamic circulation. Sometimes, there is change in growth rate and texture of nails and hair. Feet and ankles swell during pregnancy due to the increased fluid carried by the body. Leg cramps may occur due to the excessive fluid, shortage of calcium and phosphorus and fluctuation of hormones. A healthy weight gain in pregnancy is 11 kg– 1 kg in the first trimester, 5kg in the second trimester and 5kg in the third trimester. Anything between 11- 17 kgs is taken as a normal weight gain of pregnancy. There is an increase in your body temperature which will get back to normal by the 16th week. Due to increased ligament laxity, many women suffer from back pain during their pregnancy."
Obstetrics And Gynaecology,https://www.maxhealthcare.in/our-specialities/obstetrics-and-gynaecology/faqs,How do I know I’m suffering from Placenta Previa?,"Placenta previa is a sudden onset of painless, recurrent bleeding which is apparently causeless. In 5% of the cases, it occurs during labour especially for first time moms. In 1/3rd of the cases, there are ‘warning’ hemorrhages that hint towards placenta previa."
Obstetrics And Gynaecology,https://www.maxhealthcare.in/our-specialities/obstetrics-and-gynaecology/faqs,Is Placenta Previa painful?,"While it is not common for Placenta Previa to be painful, some women may experience cramping."
Obstetrics And Gynaecology,https://www.maxhealthcare.in/our-specialities/obstetrics-and-gynaecology/faqs,What treatment options are available to cure Placenta Previa?,"There is no way to prevent Placenta Previa. However, there are different ways to make sure you have a safe pregnancy: • Adequate antenatal care will help in a safe pregnancy which includes correction of anemia • ‘Warning’ hemorrhages should not be ignored • Increased fetal monitoring especially if there is history of bleeding • Bed rest as much as possible • Keep a look out for signs of pre-term labour • An increased protein intake in your diet is recommended"
Obstetrics And Gynaecology,https://www.maxhealthcare.in/our-specialities/obstetrics-and-gynaecology/faqs,How is pre-eclampsia treated?,"The objectives of treatment of pre-eclampsia are to stabilize the increased blood pressure and prevent eclampsia. Depending on your healthcare provider, you may be asked to be admittedbased on your health status. If you are showing signs toward the end your pregnancy, then delivery is the best course of action for the health of the baby and mother. However, if the delivery is too risky to the health of the baby, your doctor may prescribe absolute bed rest, anti-hypertensives, anti-convulsants and corticosteroids(These may also be given prior to delivery to help develop the baby’s lungs)"
Obstetrics And Gynaecology,https://www.maxhealthcare.in/our-specialities/obstetrics-and-gynaecology/faqs,How does pre-eclampsia affect pregnancy?,"Pre-eclampsia is the sudden development of high blood pressure (up to 140/90 mmHg) with or without protein in the urine, after 20th week of your pregnancy. It is a serious complication that leads to a difficult pregnancy, eventually leading to induction labor ahead of the due date."
Obstetrics And Gynaecology,https://www.maxhealthcare.in/our-specialities/obstetrics-and-gynaecology/faqs,What steps can I take to prevent Pre-eclampsia?,"While there is no measure that can completely stop pre-eclampsia from developing, there are certain things you can do to decrease the risks. • Be regular in your antenatal visits to your doctor. Keep a track of your blood pressure in a diary as a way of monitoring your health status especially after your 20th week of gestation. • Take your blood pressure and weight regularly to see any spikes. • Maintain a low-salt diet and make sure your calcium intake is adequate."
Obstetrics And Gynaecology,https://www.maxhealthcare.in/our-specialities/obstetrics-and-gynaecology/faqs,Can you die from pre-eclampsia?,"If untreated, pre-eclampsia can progress further into eclampsia, a condition in which a pregnant woman goes through convulsions and may fall into a coma, due to brain injury. The increased blood pressure can damage the kidneys & the liver. There is a risk of developing pulmonary edema & cause blood clots which may become fatal. Timely intervention in pre-eclampsia is the key for the best outcome of both mother and child."
Obstetrics And Gynaecology,https://www.maxhealthcare.in/our-specialities/obstetrics-and-gynaecology/faqs,What causes Ovarian Hypofunction?,"Ovarian Hypofunction is the reduced function of the ovaries that include decreased production of hormones. Most of the time the cause of Ovarian Hypofunction is unknown; however, they are a few contributing factors: • Infections such as tuberculosis & gonorrhea which damage the ovarian follicles, thus reducing their number • Autoimmune disorders such as Addison’s disease & thyroiditis • Chemotherapy & Radiotherapy may lead to depletion of ovarian follicles • Genetic conditions such as chromosome abnormalities can result in hypofunction"
Obstetrics And Gynaecology,https://www.maxhealthcare.in/our-specialities/obstetrics-and-gynaecology/faqs,What are the complications of Ovarian Hypofunction?,The most common complication of Ovarian Hypofunction is infertility. Other complications include increased risk of ovarian cancer & osteoporosis. There is a psychological component often ignored that needs to addressed and treated.
Obstetrics And Gynaecology,https://www.maxhealthcare.in/our-specialities/obstetrics-and-gynaecology/faqs,How common is Pelvic Inflammation?,"Pelvic Inflammatory Disease(PID) is one of the most common gynecological problems in the world. While the exact number cannot be determined due to unreliable diagnosis from clinical signs and symptoms, it is credited for 3 – 10% of all gynecology related hospital admission in India."
Obstetrics And Gynaecology,https://www.maxhealthcare.in/our-specialities/obstetrics-and-gynaecology/faqs,What are the treatment options for Pelvic Inflammation?,"Once findings and tests confirm PID, your doctor will prescribe you antibiotics. If the PID has progressed to form an abscess, you may need surgery."
Obstetrics And Gynaecology,https://www.maxhealthcare.in/our-specialities/obstetrics-and-gynaecology/faqs,How does Pelvic Inflammation lead to infertility?,Pelvic Inflammation causes scaring and adhesion of Pelvic tissues leading to tubal blockage and in turn infertility. Pelvic Tuberclosis perse is a major cause of infertility in India.
Obstetrics And Gynaecology,https://www.maxhealthcare.in/our-specialities/obstetrics-and-gynaecology/faqs,Will insurance cover the treatment?,"Yes, insurance should cover the treatment. Infertility till date is not covered by insurance."
Obstetrics And Gynaecology,https://www.maxhealthcare.in/our-specialities/obstetrics-and-gynaecology/faqs,Will these conditions my daily routine?,"Placenta Previa and Pre-eclampsia need bed rest, thus leading to a decreased quality of life. Barring any complications, Ovarian Hypofunction and Pelvic Inflammation, while may lead to discomfort, mood swings and mild pain, should not affect your daily routine significantly."
Obstetrics And Gynaecology,https://www.maxhealthcare.in/our-specialities/obstetrics-and-gynaecology/faqs,Do I require any post-surgery follow ups?,"There is a risk of post-partum hemorrhage in pre-eclampsia up to 6 weeks post-delivery thus follow ups are necessary. Placenta Previa may cause post-partum hemorrhage thus needs to be monitored. If there is an abscess formation in PID, post-surgery follow ups will be suggested by your doctor."
Minimal Access / laparoscopic Surgery,https://www.maxhealthcare.in/our-specialities/minimal-access-laparoscopic-surgery/faqs,What all conditions do you treat?,"We treat conditions like: Gall Bladder stones Hernia Obesity and Metabolic surgery Anorectal conditions- Bleeding Piles, fistula & fissures Appendicitis Thyroid Solid Organs Intestinal Surgery"
Minimal Access / laparoscopic Surgery,https://www.maxhealthcare.in/our-specialities/minimal-access-laparoscopic-surgery/faqs,What are the advantages of laparoscopic surgery over conventional surgery?,Endoscopic surgery causes much less pain and patients are mobile within hours after surgery. They are also allowed to resume all activities much earlier and can go back to work within 5-7 days. Another advantage is that both sides can be operated in the same sitting without any extra pain or stay. The cosmetic results are excellent.
Minimal Access / laparoscopic Surgery,https://www.maxhealthcare.in/our-specialities/minimal-access-laparoscopic-surgery/faqs,What are gallstones?,Gallstones are pieces of solid material that form in the gallbladder. These stones develop because cholesterol and pigments in bile sometimes form hard particles.
Minimal Access / laparoscopic Surgery,https://www.maxhealthcare.in/our-specialities/minimal-access-laparoscopic-surgery/faqs,What is the treatment for gallstones or cholecystitis?,The symptomatic stones and diseased gallbladder should be removed by a surgical procedure called Cholecystectomy.
Minimal Access / laparoscopic Surgery,https://www.maxhealthcare.in/our-specialities/minimal-access-laparoscopic-surgery/faqs,Don’t people need their gallbladders?,"Fortunately, the gallbladder is an organ that people can live without. Losing it won’t even require a change in diet. Once the gallbladder is removed, bile flows out of the liver through the hepatic ducts into the common bile duct and goes directly into the small intestine, instead of being stored in the gallbladder."
Minimal Access / laparoscopic Surgery,https://www.maxhealthcare.in/our-specialities/minimal-access-laparoscopic-surgery/faqs,What is hernia?,"A Hernia occurs when the contents of a body cavity protrude out of the membrane in which they are normally contained through a weak spot in a surrounding muscle or connective tissue. Hernias by themselves may or may not produce symptoms as they are asymptomatic and can cause slight to severe pain. There are various types of hernia namely- Inguinal (direct & indirect) , Femoral, umbilical and ventral (Incisional, periumbiliacl and epigastric)"
Minimal Access / laparoscopic Surgery,https://www.maxhealthcare.in/our-specialities/minimal-access-laparoscopic-surgery/faqs,Why are men prone to hernia than women?,Men are more prone to inguinal hernias than women because of basic differences in anatomy. The area where hernias occur most often has a very different function in men than in women.
Minimal Access / laparoscopic Surgery,https://www.maxhealthcare.in/our-specialities/minimal-access-laparoscopic-surgery/faqs,Do Hernias always require surgery?,"Surgery is the only way to cure a hernia. A hernia will not go away on its own. Now days, many types of surgical hernia repairs are available."
Minimal Access / laparoscopic Surgery,https://www.maxhealthcare.in/our-specialities/minimal-access-laparoscopic-surgery/faqs,What is an anal fistula?,An anal fistula is a small channel that can develop between the end of the rectum/anal canal and the skin near the anus. An anal fistula can cause bleeding and discharge when passing stools and can be painful. An anal fistula can occur after surgery to drain an perianal abscess. MAFT (VAAFT) is a major breakthrough treatment option for complex fistulas. VAAFT (The Video assisted Anal Fistula Treatment) or MAFT (Minimally Invasive Fistula Treatment) are alternatively used terms.
Minimal Access / laparoscopic Surgery,https://www.maxhealthcare.in/our-specialities/minimal-access-laparoscopic-surgery/faqs,What are Piles?,"Piles are also called haemorrhoids. Hemorrhoids are masses, clumps, cushions of tissue in the anal canal - they are full of blood vessels, support tissue, muscle and elastic fibers. Haemorrhoids are classified into two general categories: internal and external. The treatment options available are as follows: Depending on the diagnosis, the doctor advises if home treatment is all you need or further intervention is required. Lifestyle and dietary modifications such as regular physical exercise, plenty of fluids and a high fibre diet provide symptomatic relief. Surgery: Surgery is used for particularly large piles. Generally, surgery is used when conservative treatment/management is not effective. Sometimes surgery is done on an outpatient basis - the patient goes home after the procedure."
Minimal Access / laparoscopic Surgery,https://www.maxhealthcare.in/our-specialities/minimal-access-laparoscopic-surgery/faqs,What are the types of surgery available for piles treatment?,"Haemorrhoidectomy (open surgery of the piles): the excess tissue that is causing the bleeding is surgically removed. This can be done in various ways. It may involve a combination of a local anesthetic and sedation, a spinal anesthetic, or a general anesthetic. This type of surgery is effective in completely removing piles, but is associated with pain for few days. Minimally Invasive Procedure for Hemorrhoids (MIPH): This technique uses stapler for performing the surgery. It is relatively painless and be done as a day care surgery"
