specialty,link,question,answer
Diabetes & Endocrinology,https://www.maxhealthcare.in/our-specialities/diabetes-and-endocrinology/faqs,How does diabetes affect the body?,"Diabetes is a metabolic disease that affects multiple organs of the body. It may cause long term complications heart disease, stroke, diabetic foot and gangrene, retinopathy, neuropathy and kidney problems. Uncontrolled diabetes can also cause skin infections, poor-wound healing, recurrent urinary tract infections, and genital infections. It also predisposes to infections like tuberculosis."
Diabetes & Endocrinology,https://www.maxhealthcare.in/our-specialities/diabetes-and-endocrinology/faqs,Does diabetes cause hair loss?,"Diabetes interrupts the hair growing process, which decreases the rate of hair growth. At the same time, it is responsible for the loss of hair from the head, chest, arms and legs."
Diabetes & Endocrinology,https://www.maxhealthcare.in/our-specialities/diabetes-and-endocrinology/faqs,Will there be any change in my lifestyle after being diagnosed?,There is a need for change in lifestyle after diagnosis as the best way to control diabetes is to take proper medications along with diet-control and regular exercise. These changes are long term and need to be incorporated in your life style.
Diabetes & Endocrinology,https://www.maxhealthcare.in/our-specialities/diabetes-and-endocrinology/faqs,Do I require post treatment follow ups?,"Yes, you will require regular post treatment follow up to control diabetes."
IVF,https://www.maxhealthcare.in/our-specialities/ivf/faqs,Is the IUI procedure painful? Is the rupture checked before IUI?,"IUI is more like a pap test. If required your doctor might give you anesthesia. In majority of the cases, when an injection for rupture is given, the follicles rupture between 36-48 hours. The inseminated semen sample has viable sperms for atleast 40-72 hours."
IVF,https://www.maxhealthcare.in/our-specialities/ivf/faqs,What is the difference between IVF and ICSI?,"There is not much difference rather both are procedures of In-vitro Fertilization. In IVF, the egg and sperms are allowed to fertilize naturally. This method is indicated when the sperm parameters are normal. ICSI is primarily for Male Factor Fertility, where egg is injected by using a needle with the sperm."
IVF,https://www.maxhealthcare.in/our-specialities/ivf/faqs,How many times can I try IVF? Is it harmful for my body?,"To determine how many times you can try IVF, you will be judged on certain parameters like: o Clinical profile of patient o Age of Female partner o Response to the previous IVF cycle o Financial position If the above criteria are met then at the most you are eligible for 3-4 attempts. It is true that any surgical procedure has its inherited risk but the overall rate of surgical complication during egg collection is minimal."
IVF,https://www.maxhealthcare.in/our-specialities/ivf/faqs,How long is the entire IVF procedure?,There are primarily two protocols: Long and Short. The short protocols begin within the first 3 days of menstrual cycle while the long protocols (conventional) begin after 21 days of previous cycle.
IVF,https://www.maxhealthcare.in/our-specialities/ivf/faqs,When will I know if I will be pregnant after IVF?,"Usually, the first signs of pregnancy occur after 2 weeks after the embryo transfer. While the signs may vary from case to case, the most common one are: • Missed period – IVF patients often have missed or irregular periods two weeks after the embryo transfer. • Breasts Change – Changes in your breast may vary from size, sense of fullness, or being very tender to touch. • Headaches/Fatigue/Nausea – Usually caused by a surge of hormones, which indicate that either you’re ready to menstruate or you are on hormone therapy. Your IVF was successful and your body is getting ready to nourish a new life. • Frequent Urination and excessive thirst – Another sign would be excess urination since your metabolism is changing and is preparing to handle the baby growing inside of you. You will urinate frequently and feel thirsty. • Bleeding or spotting –Bleeding is a good indication if you are undergoing hormone therapy. • Mood swings -Probably the most common signs in pregnancy, occurs even after undergoing IVF."
IVF,https://www.maxhealthcare.in/our-specialities/ivf/faqs,Can I exercise while undergoing IVF?,"Although exercise generally helps in healthy conceiving, it is a tricky situation and needs to be strictly monitored while undergoing IVF as too much exercise seems to have an effect on reproductive hormone production that affects the ability to conceive. It is advised that you discuss an exercise plan with your doctor to avoid a miscarriage. However, be prepared that you will have days when there will be no exercise."
IVF,https://www.maxhealthcare.in/our-specialities/ivf/faqs,Is the egg retrieval painful?,"During egg retrieval, you will be sedated and given pain medication so you will not feel anything. However, after the procedure/surgery is done, you may experience cramping, feeling of fullness or soreness."
IVF,https://www.maxhealthcare.in/our-specialities/ivf/faqs,Is bleeding expected after egg retrieval?,"After egg retrieval, usually patients feel cramped since the eggs in the body are enlarged due to excess hormone production. Vaginal bleeding or spotting is common but it is similar to the bleeding experienced during the time of periods. However, if there is excess bleeding, then inform your doctor immediately."
IVF,https://www.maxhealthcare.in/our-specialities/ivf/faqs,What can we do to increase our chances of IVF?,"There are many myths related to conceiving and success rates of IVF which may or may not be true. However, there are a few natural methods which can be followed to increase your chances of success. • Be stress free – Easing stress helps to speed things. A study proves that women who watched funny performances for about 15 minutes after undergoing IVF were nearly three times more likely to become pregnant. However, don’t stress too much on de-stressing yourself. Take out 15 – 20 min every-day to ease your mind and figure out what keeps you relaxed. • Don’t over-exercise– Exercise is good and can increase your chances of fertility but too much of it is counter-productive. It is a form of physiological stress which can harm your chances of becoming pregnant. A better alternative would be to do Yoga for half an hour everyday. • Vitamin D dosage – Most commonly consumed to increase bone health, Vitamin D also affects the chances of reproduction. Women with Vitamin D deficiency have a low chance of getting pregnant than women who have sufficient amount of Vitamin. Therefore, it is advised to consume Vitamin D but careful not to overdo it. • Establish a healthy weight – It is very important to maintain a healthy weight if you’re planning to have a baby through IVF. Being overweight has been linked to negative outcomes of IVF, decrease in pregnancy rate, delivery rate and increase in miscarriage. Obesity appears to hurt the eggs and maybe the endometrium."
IVF,https://www.maxhealthcare.in/our-specialities/ivf/faqs,How long do I have to stay in the hospital during and after the procedure?,The IVF procedure does not require any hospitalization. It is done on an OPD basis which requires regular visits with the doctor for a couple of hours or more. A normal IVF cycle takes around 18 – 20 days but may vary from case to case.
IVF,https://www.maxhealthcare.in/our-specialities/ivf/faqs,Does IVF increase chances of conceiving twins or triplets?,This is one of the most sought after questions during the initial stages of consultation and many are under the impression that it does increase the chances of multiple birth. There is no guarantee that you will conceive multiple births after the doctor has transferred the embryo. It is advised not to have any expectations but hope for the best in such cases.
IVF,https://www.maxhealthcare.in/our-specialities/ivf/faqs,What are the risks associated with IVF?,"There are various risks associated with IVF. Some of them are mentioned below. • Hyperstimulation Syndrome – Usage of injectable fertility drugs to induce ovulation can cause the ovaries to swell and be painful. This will make you feel nauseated, experience abdominal pain, vomiting etc. • Birth Affects –There are chances that your baby might have a premature birth or have a low birth weight which may ultimately lead to birth defects. • Ectopic pregnancy – If you have undergone IVF procedure, chances are you will experience ectopic pregnancy. This refers to when the embryo implants itself in the fallopian tube. This results in pain in the stomach area, vaginal bleeding or dark vaginal discharge. • Miscarriage – This is more likely to occur in older women since age plays a major role in IVF and the success rate decreases with increase in age."
IVF,https://www.maxhealthcare.in/our-specialities/ivf/faqs,How soon can I get back to a normal life after IVF?,"Once the embryo transfer is done, you can resume a normal life. You may experience cramps because there can be a minor swelling in the ovaries. Stick to a mild routine and avoid exertion as it can affect your chance of getting pregnant."
IVF,https://www.maxhealthcare.in/our-specialities/ivf/faqs,Is there any post treatment follow ups?,"A positive pregnancy test is just one step in the process of IVF. The doctor will check your level of hCG (Human Chorionic Gonadotropin) in your blood. There is no magic number to ascertain or guarantee your pregnancy but the idea is that it should double every 48 hours. If that is not happening then the doctor will conduct a blood test. Based on you hCG level, the doctor will take various measures to ensure that the pregnancy is stable and successful."
Urology,https://www.maxhealthcare.in/our-specialities/urology/faqs,What all you need to carry/inform to your Doctor during the first appointment?,"Before meeting your urologist for the first time, here’s a checklist of items you should be prepared: 1. All symptoms along with their characteristics and duration 2. All recent medical tests such as blood tests, urine tests, etc. 3. If you have any existing medical conditions, bring along your prescription and related medical information 4. Information about your family history 5. Your insurance details or company ID card, if the hospital is on your panel."
Urology,https://www.maxhealthcare.in/our-specialities/urology/faqs,Will any urinary problems affect my sex life?,"Urinary problems such as incontinence, prostate problems or UTI’s (Urinary Tract Infection) have a detrimental effect on the sex life. Patients with urinary problems should talk to their doctor openly about sexual issues if any."
Urology,https://www.maxhealthcare.in/our-specialities/urology/faqs,How often does kidney stone appear and what causes it?,"In India, it is expected 12 % of the population is expected to have urinary stones, with recurrent stones a possibility, in almost 50% of stone patients. Kidney stones are normally due to an extra build-up of calcium, uric acid, oxalates or phosphates in urine. Causes of kidney stones:  Due to recurrent infections, such as UTI.  Hot climate increase the concentration of solutes in urine  Dehydration: People who drink less than the recommended 8 – 10 glasses of water may be susceptible to kidney stones  Metabolic causes such as hyperparathyroidism, Gout  Immobilization (such as a paraplegic patient), sedentary life style  Randall’s plaques  Renal anomalies like PUJ obstruction.  Family history of stone formers  Some drugs leads to stone formation"
Urology,https://www.maxhealthcare.in/our-specialities/urology/faqs,Does diet affect the formation of kidney stones?,"Yes, diet affects the formation of kidney stones. Not drinking enough water, diet rich in red meat, dry fruits, calcium and oxalates can cause kidney stones."
Urology,https://www.maxhealthcare.in/our-specialities/urology/faqs,Can diabetes cause prostatitis?,Prostatitis is most common urological problem in males. Uncontrolled diabetes predisposes for infection in body including prostate.
Urology,https://www.maxhealthcare.in/our-specialities/urology/faqs,Is prostatitis contagious? Can it be prevented?,"Prostatitis due to bacterial infection is contagious. Unsafe sex can lead to spread of the bacteria to the partner. There are certain measures one must take to make to avoid prostatitis:  Hygiene is your priority. Make sure you are cleaning yourself regularly especially your penis and foreskin  Ejaculate regularly- if you ejaculate infrequently or practice ‘Bhramcharya’, your semen (prostatic secretions) accumulates inside prostate and leads to infection.  Do not go for urination immediately after sex/ ejaculation. If you urinate immediately after ejaculation, urine enters into opened prostatic glands orifices and causes prostatitis.  Hydrate yourself to make sure your urination is adequate.  If you are prone to UTI’s, get routinely examined.  If you are diabetic, get regular checkups and control your blood sugar level.  Practice safe sex"
Urology,https://www.maxhealthcare.in/our-specialities/urology/faqs,What are the risk factors of prostatitis?,"The risk factors of prostatitis are:  Infrequent Ejaculation or abstinence from sexual activity  Urination immediately after ejaculation  Bladder outlet obstruction such as BPH, Stricture urethra, Stones, Tumors  A suppressed immune system,  Catheterization  Unprotected sex / Multiple Partners  Diabetes Mellitus"
Urology,https://www.maxhealthcare.in/our-specialities/urology/faqs,What treatment options are available for prostatitis?,"Unlike common infections, in prostatitis antibiotics are required for 4 to 6 weeks duration. Analgesics are given for short period for controlling acute symptoms. Alpha blocker medicines of prostate are given to increase penetration of antibiotics into prostate gland. In chronic or recurrent cases some medicines need to be taken for long period."
Urology,https://www.maxhealthcare.in/our-specialities/urology/faqs,Does delivery of a baby lead to pelvic prolapse or urinary incontinence?,"Normal vaginal delivery causes weakening of pelvic muscles which can be regained by exercises. In ladies who have multiple vaginal deliveries or prolong / obstructed delivery, pelvic muscles weaken permanently and may lead to prolapse of pelvic organs like uterus and urinary bladder. It may also cause leakage of urine during physical stress like coughing or laughing."
Urology,https://www.maxhealthcare.in/our-specialities/urology/faqs,Is pelvic prolapse treated surgically?,"When the prolapse is in its early stages and is mild, it can be treated non-surgically with the help of strengthening exercises and physiotherapy. If the prolapse or the ligaments are torn or the prolapse occurs in a late stage, surgery is indicated."
Urology,https://www.maxhealthcare.in/our-specialities/urology/faqs,What treatment options are available for pelvic prolapse?,": Depending on the type and progress of the prolapse, there are surgical & non-surgical treatment options. Non-surgical treatments include physiotherapy to strengthen the pelvic floor muscles to retract the prolapse, changing diet and bowel habits, use of a pessary (a rubber device placed inside the vagina) to give additional support. Surgery is done to retract the prolapse, repair the torn ligaments and fascia. A synthetic mesh may be used to give additional support."
Urology,https://www.maxhealthcare.in/our-specialities/urology/faqs,What is Hematuria and is it a serious condition?,"When you find blood in urine that is known as hematuria. Hematuria is a sign, rather than a condition, for a range of conditions, from kidney disease to an enlarged prostate. It may be early sign for cancer. Therefore even if hematuria resolves by its own or by some medications, it should always be investigated for its cause. Ignoring it at early phase may lead to advancement of disease specially cancer. In adult more than 40 year of age, even a single episode of hematuria should warrant investigations to rule out cancer."
Urology,https://www.maxhealthcare.in/our-specialities/urology/faqs,Does Hematuria require surgical intervention?,"Depending on the underlying cause for hematuria, one might need surgical intervention."
Urology,https://www.maxhealthcare.in/our-specialities/urology/faqs,What is BPH and is it harmful?,"Benign Prostate Hyperplasia (BPH) is an enlargement of prostate gland. The prostate is a walnut-shaped gland in men, placed around the urethra below urinary bladder. It is not testis as confused by a few. This enlarged gland slowly squeezes on the urethra and decreases the flow of urine. BPH is a normal, aging process for men. In more than 50 % individuals it causes urinary problems and requires treatment. Mostly these problems can be managed by medicines but sometimes surgery is required. Now a day’s prostate surgery is done by endoscopy which is minimally invasive and use of laser make it further safe even in high risk old age individuals."
Urology,https://www.maxhealthcare.in/our-specialities/urology/faqs,Are there any long-term side effects of BPH?,"Urination problems such as difficulty of starting stream, poor flow, frequent urination especially at night, unable to control urination and sometime leakage are common symptoms of BPH. If these are not treated well in time it may lead to complications like blood in urine or semen, urine retention, bladder muscle weakness, kidney failure, hernia formation, stone formation etc. If these complications appear then surgery becomes mandatory. Erectile and ejaculatory dysfunction may occur."
Urology,https://www.maxhealthcare.in/our-specialities/urology/faqs,Will my insurance cover the cost of treatments?,Most of the insurances and panel cover the treatment for prostate.
Urology,https://www.maxhealthcare.in/our-specialities/urology/faqs,What steps can I take to prevent prostate problems?,The certain steps one can take to prevent prostate problems:  Exercising regularly  Healthy balanced vegetarian diet  Healthy frequency of ejaculation  Hygiene of the penis and the surrounding areas  Safe sex
Urology,https://www.maxhealthcare.in/our-specialities/urology/faqs,What is prostate cancer and how common is it?,"Prostate cancer is second most common cancer in males. It is abnormal and unregulated growth of prostatic cells. When it advance and spread to bones and other organs, it may lead to death. In India, due to lack of awareness most of the cases present at advance stage. However even in advance stage, its treatment is quite successful to lead the patient his normal life."
Urology,https://www.maxhealthcare.in/our-specialities/urology/faqs,What causes prostate cancer and can we prevent it?,"Prostate cancer is due to the genetic mutation of certain prostate cell lines. Risk factors such as advancing age, family history, race, geography may also affect the chance of cancer developing. There are certain considerations that one can adopt to prevent prostate cancer :  Maintain a healthy body weight  Limit your red meat and dairy intake  Balances vegetarian diet  Exercise regularly  Ejaculate regularly  Avoid smoking  Drink in moderation  Avoid over the counter health promotion drugs / supplements  After the age of 40, go for a yearly rectal exam with/without a PSA test. Talk to your urologist about prostate cancer screening."
Urology,https://www.maxhealthcare.in/our-specialities/urology/faqs,Do I require any post-surgery follow ups?,"Depending on the type of surgery, your recovery and healing, your doctor will schedule follow ups."
Nutrition and Dietiecs,https://www.maxhealthcare.in/our-specialities/nutrition-and-dietiecs/faqs,What all should I carry for my first appointment with a dietician?,"It is important to carry all your medical reports, doctor’s prescription. A diet dairy with the necessary details (if you have maintained any) like: Your weight, daily intake of calories, any exercise plan you have maintained, and what you have been eating for 10-15 days etc. In case you are using any nutrition supplement, do remember to mention it too. If you are Diabetic remember to carry blood sugar charting. Try to maintain the short term and long terms goals of your diet and take assistance from dietician in achieving it."
Nutrition and Dietiecs,https://www.maxhealthcare.in/our-specialities/nutrition-and-dietiecs/faqs,What should be my ideal diet to stay healthy?,"Healthy eating means consuming the right portions (Quantity) of foods from all food groups to lead a healthy life. We need a wide range of nutrients to lead a healthy and an active life style. The requirement of nutrient keeps changing in different phase of life. For e.g. Infancy would require breastfeed for 6 month followed by good weaning, whereas a preschooler a balanced diet ,more of proteins containing the essential food groups and nutrients - vitamin A, C, calcium, iron and zinc. A Healthy good diet should be fitting in your nutritional lifestyle and not lifestyle fitting in diet, if later is followed compliance would be only for a short span."
Nutrition and Dietiecs,https://www.maxhealthcare.in/our-specialities/nutrition-and-dietiecs/faqs,What happens if we consume excess nutrients?,"Even when you're eating healthy foods and staying active, it's still possible for you to consume more nutrients than your body needs. Excess nutrients can come from dietary supplements containing high amounts of vitamins and minerals or simply from eating more calories daily than your body uses. If you are eating excess calories than you are able to burn the side effect is overweight or obesity . Obesity is a key to non-communicable diseases like Hypertension. DM , CVD , etc ""Excesses of all nutrients, from water, to iron, to water-soluble B vitamins, can potentially cause toxicities, if you take vitamins and minerals in amounts above the established upper limits of the Recommended Dietary allowances (RDI) may harm tissues where the vitamin is stored in their body. That’s why you shouldn’t take more than the recommended amount. ""Certain water-soluble vitamins in excess can cause problems, such as too much vitamin B6 can cause nerve problems, too much niacin can cause flushing, and excess vitamin C can cause kidney stones. ""Too much vitamin A, D, or K can lead to increased levels that are unhealthy and can cause health consequences, too much vitamin A can lead to birth defects, and too high levels of vitamin E may increase the risk of hemorrhaging. Excess vitamin K can lessen or reverse the effect of blood thinner medicines and prevent normal blood clotting. Excess of vitamin D can increase blood level of calcium and eventually cause calcium deposits in soft tissues."
Nutrition and Dietiecs,https://www.maxhealthcare.in/our-specialities/nutrition-and-dietiecs/faqs,What is defined by an ideal fiber intake?,A minimum intake of 20-35 g of fiber is conducive for long-term good health .WHO Committee on chronic degenerative diseases recommended a daily intake of 30 g dietary fiber. An intake in excess of 60 g of fiber over a day can reduce the absorption of nutrients and may cause irritation in the bowel and also lead to diarrhoea. The intake of 40 g/ 2000 kcal may be rationalized in different groups based on recommended energy intake.
Nutrition and Dietiecs,https://www.maxhealthcare.in/our-specialities/nutrition-and-dietiecs/faqs,Will proper diet help me reduce excess weight?,"A healthy body has a healthy mind. Not only does a good diet keeps you rejuvenated throughout but also helps in maintaining your body weight. Few simple steps of working towards weight loss can be : • Eat 5 – 6 Small frequent meals • Snack Smart (Handful nuts, fruits , Roasted Grams , granola bars, soups, bhel , dhokla, khandvi, idli , boiled egg, Fruit smoothies made with low cal dairy / sugar, sprouts ,etc) • Remember Funda of 5 (Daily intake 5 fruits and vegetables) • Pack homemade food, avoid junk and high calorie, high on oil canteen food. • Moderation in sugar (2tsp / Day) and oil (3 - 4tsp/day) consumption, Use combination of oils • Use toned or double toned milk and its products • Never skip meals specially Breakfast and eat early dinner by 8:00 - 8:30pm, Remember the saying eat Breakfast like a king, Lunch like a prince and dinner like a pauper • Maintain the equilibrium: Eating the same number of calories as you would burn to maintain a healthy diet • Controlling salt/sodium consumption and ensuring that you use iodized salt. • Drink enough water A combination of physical activity of atleast a 30 minute walk per day with a moderation in calorie intake would do wonders. Drastic weight loss programs can be rarely sustain."
Nutrition and Dietiecs,https://www.maxhealthcare.in/our-specialities/nutrition-and-dietiecs/faqs,What causes rickets in children?,"vitamin D deficiency. Vitamin D promotes the absorption of calcium and phosphorus from the gastrointestinal tract. A deficiency of vitamin D makes it difficult to maintain proper calcium and phosphorus levels in bones, which can cause rickets. Other factors that may cause rickets among children are : • Lack of vitamin D during pregnancy • Geographical locations: where there is less sunshine • Premature birth • Children who are exclusively feed on breast milk, should receive Vitamin D drops"
