specialty,link,question,answer
Nephrology,https://www.maxhealthcare.in/our-specialities/nephrology/faqs,What are the advantages of ABO Incompatible transplant?,"ABO incompatible transplant is when the donor & recipients blood types don’t match. Earlier it was not undertaken as the rejection of the organ was extremely common. However, with the help of a more aggressive regimen of immunosuppressives & a better understanding of immunology, ABO incompatible transplants are being done around the world. This has led to greater donor pool & a reduced number of deceased kidney transplants for patients with end-stage renal disease. In recent years, the outcome of ABO incompatible kidney transplant has been equivalent to ABO compatible kidney transplant."
Nephrology,https://www.maxhealthcare.in/our-specialities/nephrology/faqs,How can urinary incontinence be managed?,"Depending on the kind of incontinence and the underlying cause responsible, there may be a few things your doctor might recommend:  Drinking 6-8 glasses of water  High fiber diet to avoid constipation  Pelvic floor strengthening exercises  Learning how to properly use the toilet e.g. not to use too much pressure, posture while sitting etc.  Medications  Pads, catheters, sponges etc. to aid in managing incontinence."
Nephrology,https://www.maxhealthcare.in/our-specialities/nephrology/faqs,Which tests can a nephrologist recommend?,"Depending on your physical examination, history of illness & symptoms, your nephrologist might ask you to get tested for the following:  Complete blood test  Urine routine/Microscopy and Culture Test  Kidney function tests that include potassium, calcium, creatinine, BUN (blood urea nitrogen)  Blood cholesterol, if you have high pressure  Ultrasound Imaging of Kidneys"
Nephrology,https://www.maxhealthcare.in/our-specialities/nephrology/faqs,How can stress incontinence be managed?,"When you do an activity that build up pressure in the abdomen and presses down on the bladder such as coughing, sneezing, sometimes a small quantity of urine passes. This is known as stress incontinence. It is seen more in women who have just gone through pregnancy, childbirth and menopause. Try to do more of pelvic floor exercises to deal with the problem of stress incontinence. Those who are overweight have a higher chance of developing stress incontinence. Therefore, it is important to have a healthy weight to manage the problem"
Nephrology,https://www.maxhealthcare.in/our-specialities/nephrology/faqs,What are the surgical options to treat Prostate enlargement (BPH)?,"Benign prostate enlargement is a naturally aging process that leads to hypertrophied prostate. Depending on the health status of the patient and the discretion of the surgeon, there are a few surgical options: - TURP - Bipolar TURP - Laser Prostatectomy (HOLEP)"
Nephrology,https://www.maxhealthcare.in/our-specialities/nephrology/faqs,Are there any dietary changes required?,"While BPH is due to genetic and environmental factors, dietary changes may help reduce the risks of BPH:  A low fat, low salt, low carb diet with fiber.  5 or more servings vegetables/day  Foods that have significant amount of vitamin C & zinc  < or = 2 glasses of alcohol"
Nephrology,https://www.maxhealthcare.in/our-specialities/nephrology/faqs,What should be the Pre-surgery and Post-surgery instructions?,"Pre-Surgery: • Ask your doctor all your doubts prior to the surgery • If using insurance, confirm with your insurance provider and hospital the documents needed. • Nil by mouth (NBM) 12 hours before the procedure • Pre-anesthetic checkup (PAC) will be done Post-Surgery Depending on the type of surgery, the post-operative instructions differ • No solid food for 24 hours. Slow introduction of semi-solid meals for the next 2-3 days • You will have an IV in your hand and will be given antibiotics, analgesics to ease the pain"
Nephrology,https://www.maxhealthcare.in/our-specialities/nephrology/faqs,How frequent should I schedule my follow-ups?,"Depending on the disease & health status of the patient, your doctor might want to schedule follow up appointments. Ideally, you should follow up with your doctor once in 6 months."
Orthopedics,https://www.maxhealthcare.in/our-specialities/orthopedics/faqs,What should I carry for my first appointment?,"For your first visit, you should carry the following things: 1. A list of describing your symptoms in details (When, What, How Long). 2. Any recent (<1 year) medical investigations such as blood tests, X Rays, etc. 3. If you have any existing medical conditions, carry along your prescription and list of current medications you are taking. 4. Your insurance details or company ID in case the hospital is on your health panel."
Orthopedics,https://www.maxhealthcare.in/our-specialities/orthopedics/faqs,How common is arthritis and can it be prevented?,"Arthritis is one of the most common ailments seen in the country. This disease is difficult to control because it is caused primarily by increasing age and family history. However, one can reduce the risks of developing arthritis by exercising regularly and maintaining a healthy lifestyle."
Orthopedics,https://www.maxhealthcare.in/our-specialities/orthopedics/faqs,How can I diagnose myself for arthritis?,"While a proper diagnosis can only be given by a trained physician, there are symptoms that you can look out for that may be due to arthritis: 1. Joint pain (especially in the fingers, feet and knees) 2. Joint swelling 3. Fatigue 4. Joint redness and warmth 5. Joint deformity 6. Loss of range of motion of joints 7. Involvement of multiple joints 8. Loss of joint function 9. Joint stiffness 10. Limping 11. The joints on both sides are affected 12. Fever 13. Anemia If you notice any one or more of the above symptoms, consult your doctor immediately."
Orthopedics,https://www.maxhealthcare.in/our-specialities/orthopedics/faqs,Is arthritis genetic?,Primary osteoarthritis is a degenerative disorder due to ageing process. In some cases arthritis is an auto-immune disorder that develops due to genetic & environmental factors. While it is still unclear what is the exact cause of arthritis but you have a higher risk of developing arthritis if a close relative has arthritis.
Orthopedics,https://www.maxhealthcare.in/our-specialities/orthopedics/faqs,"""What precautions should I take while exercising if I have arthritis?""","Exercising is one of the best ways to manage arthritis as it helps in strengthening the muscles around the joint and prevents further progression. Low-impact exercises such as swimming & bicycling are ideal for arthritis where there is less pressure on the joints. If the joint is swollen or painful, rest an extra day and ice the swelling down. Wear supportive footwear and gear that decreases the impact on hips, ankles and knees. Avoid using steps or any inclined plane instead use levelled surface The main objective is to be on a regular exercise schedule. Often patients end up doing exercise due to the pain. This leads to further decrease in the range of movements and stiffening, thereby worsening the condition"
Orthopedics,https://www.maxhealthcare.in/our-specialities/orthopedics/faqs,What treatment procedures are there for arthritis?,"As of now, there is no cure for arthritis. However, there are drugs and physical therapy regimen that helps with the pain and reduces the chances of further inflammation. According to the severity of your condition, your doctor may prescribe the following: 1. Drugs that reduce the pain: Painkillers such as paracetamol & NSAID’s (Non-Steroidal Anti-Inflammatory Drugs). Steroids may be given in injectable or tablet forms for a short period of a time. 2. DMARD’s (Disease Modifying Anti Rheumatic Drugs) & biological response modifiers are used to suppress the inflammatory agents of arthritis. 3. Physical therapy is an important aspect in the treatment of arthritis. Hydrotherapy, physiotherapy and occupational therapy helps in regaining your range of motion and doing daily household work with arthritis."
Orthopedics,https://www.maxhealthcare.in/our-specialities/orthopedics/faqs,How can I diagnose osteoporosis?,"While the diagnosis of osteoporosis can be only made by a trained physician after a physical examination and medical investigations, there are symptoms that point towards osteoporosis. Most people don’t know they have osteoporosis until their first bone fracture. However, patients complain of back pain, gradually loss of height, stooped posture and fractures of hip, spine or wrists may strongly suggest osteoporosis."
Orthopedics,https://www.maxhealthcare.in/our-specialities/orthopedics/faqs,"""Are there any natural ways of strengthening the bones?""","One can strengthen their bones in the following manner: 1. A balanced diet: Eat fresh, locally produced fruits and vegetables and try to avoid processed foods, refined sugars & white flour. Multi vitamin tablets should be considered to boost up the nutritional status 2. Exercise: Exercising helps in strengthening the muscles around the joints and delays bone loss. The key is to be regular and slowly increase your activity level. 3. Get adequate Vitamin D: Start your day soaking in the sun or take Vitamin D to reduce the risk of osteoporosis. 4. Decrease your stress levels as cortisol (stress hormone) has a detrimental effect on bones. Try mediation or join a hobby to decrease your stress levels. 5. Try avoiding acidic food and fizzy drinks to protect bone loss."
Orthopedics,https://www.maxhealthcare.in/our-specialities/orthopedics/faqs,What is the common age for osteoporosis to occur?,"Osteoporosis is commonly seen in women post-menopause. Around 2 in 100 women have osteoporosis by the age of 50 which increases to 1 in 4 by the age of 80. However, there have been cases where osteoporosis occurred at any age."
Orthopedics,https://www.maxhealthcare.in/our-specialities/orthopedics/faqs,Does family history play a role in osteoporosis?,Those who have a family history have a higher risk of developing of osteoporosis than those who have no family history.
Orthopedics,https://www.maxhealthcare.in/our-specialities/orthopedics/faqs,"""Does consumption of soft drinks have an impact on my bones?""","Yes, soft drinks have an impact on your bones. Firstly, the increased intake of soft drinks displaces milk or fruit juice from your diet. Secondly, phosphoric acid is a main component of soft drinks. Due to the increased intake of phosphorus, there is not enough calcium to maintain the balance which directly leads to lowering the bone density. Lastly, most soft drinks have caffeine in them which interferes with calcium absorption."
Orthopedics,https://www.maxhealthcare.in/our-specialities/orthopedics/faqs,"""Will consuming calcium supplements help in tackling osteoporosis?""",Adult men over the age of 50 need between 1000-2000mg & adult women need between 1200-2000mg. Calcium supplements help maintain the daily intake of calcium to prevent osteoporosis.
Orthopedics,https://www.maxhealthcare.in/our-specialities/orthopedics/faqs,Will I need surgery for the treatment of osteoporosis?,"You will only need surgery if you have an osteoporotic fracture (Common sites are hip, spine, & wrist)"
Orthopedics,https://www.maxhealthcare.in/our-specialities/orthopedics/faqs,What cause Spondylosis and how often does it occur?,Spondylitis (inflammation of the vertebrae around the spine) has a strong genetic link. Most patients who have spondylitis carry the HLA-B27 gene.
Orthopedics,https://www.maxhealthcare.in/our-specialities/orthopedics/faqs,"""What are do’s and don’ts of a person suffering from spondylosis?""","There are certain precautions one needs to takes when dealing with spondylitis  DO follow up with your doctor regularly.  DON’T avoid exercising. Regular exercising & a healthy body weight leads to a better quality of life  DO inform your doctor of any side effects of any of the medications you take  DON’T slouch or sit without support. While standing, make sure you a  DO eat a healthy and alkaline-based diet to help reduce the inflammation.  DON’T skip your medicines under any circumstances  DO strengthening exercises for your neck/back on a regular basis  DON’T lift heavy weights. 7 Tips to Protect Your Spine from Spondylosis"
Orthopedics,https://www.maxhealthcare.in/our-specialities/orthopedics/faqs,Will my insurance cover the cost of treatments?,Yes if policy is minimum 3 years old and the disease has already been declared in the policy.
Orthopedics,https://www.maxhealthcare.in/our-specialities/orthopedics/faqs,How can we diagnose a spinal fracture?,"On taking history of the patient, those with a spinal fracture have the following complaints: 1. Back pain: It is a sudden, continued high intense pain that increases on walking or standing and decreases on lying down. 2. Any kind of deformity or disability 3. Any loss of height. On examination, there is tenderness at the site of the fracture. It is then confirmed by an X Ray."
Orthopedics,https://www.maxhealthcare.in/our-specialities/orthopedics/faqs,What are the treatment options for spinal fractures?,"The first line of treatment is conservatives:  Analgesics are given to help with the pain  Calcium and Vitamin D supplements are given to increase the levels.  Bed rest for a short period is recommended. Extended period of bed rest can lead to increased bone loss and loss of mobility.  External back brace helps to reduce the pressure on the back The pain should decrease within a few days or weeks. However, if the pain is still present after 3 months, surgery is considered. There are 2 main types of surgery that help in spinal fracture: Kyphoplasty & Vertebroplasty."
Orthopedics,https://www.maxhealthcare.in/our-specialities/orthopedics/faqs,"""What precautions shall I keep while suffering from spinal fracture?""","If you have been diagnosed with a spinal fracture, there are certain precautions one must take.  Follow your doctor’s advice. Even if there is symptomatic relief, get clearance from your doctor before resuming activities that may lead to stress on the back  Bed rest should be strictly adhered. However, extended periods cause more harm than heal so slowly build up your ambulatory functions  Don’t skip your painkillers  Make sure you’re taking your calcium and Vitamin D supplements in adequate dosage regularly.  Maintain a healthy diet. Try to avoid gaining weight during your bed rest which may increase the stress on your back."
Orthopedics,https://www.maxhealthcare.in/our-specialities/orthopedics/faqs,Do I require any post-surgery follow ups?,Your doctor will ask for post-surgery follow ups to check on your progress and to make sure your calcium and Vitamin D levels are within range.
Gastroenterology,https://www.maxhealthcare.in/our-specialities/gastroenterology/faqs,What all should I carry for my first appointment?,You should be empty stomach. Please bring a responsible attendant and all your health related and medication related documents. Please also indicate if you have any allergies
Gastroenterology,https://www.maxhealthcare.in/our-specialities/gastroenterology/faqs,What is endoscopy and how is it done?,"Endoscopy is done by inserting a thin line instrument (endoscope), in the patients’ body to view the internal blood vessels. It does not require the surgeon to make incisions and despite that view the problems."
Gastroenterology,https://www.maxhealthcare.in/our-specialities/gastroenterology/faqs,Is endoscopy a painful procedure?,"Endoscopy is not a painful procedure but most people may experience a mild discomfort. In case the patient is still not comfortable, then the doctor gives a local anesthesia to numb the particular area or a sedative to help you relax more."
Gastroenterology,https://www.maxhealthcare.in/our-specialities/gastroenterology/faqs,What causes colon cancer?,The colon is another term for the long intestine is the lowest part of the digestive system. Colon Cancer is when there is uncontrolled cell growth in the colon area. Most colon cancers originate from small non-cancerous tumors called adenomatous polyps that form the inner walls of the large intestine. It is the third most common cancer among men and second most common among women. Certain indviduals have genetic susceptibility to develop cancer.
Gastroenterology,https://www.maxhealthcare.in/our-specialities/gastroenterology/faqs,Can Colon Cancer be prevented? If yes then how?,"Yes it can be prevented. You can follow few measures to control the spread of cancer like: • Get regular screening – Probably the best way to have an early detection of colon cancer is to get a colonoscopy done at regular intervals. This will help you in keeping track of your health. • Don’t smoke –Smoking can have adverse effects on your body. It not only increases the risk of cancer but also lead to diseases of lungs, heart, and throat. • Avoid consumption of red meat – Studies have found that eating too much red meat can increase the chance of colon cancer. Consuming processed meat doubles the risk of getting cancer as much as red meat. • Maintaining a healthy weight is important to reduce the risk of cancer. Combine your diet plan with proper exercise to be fit. If you intend on losing weight, discuss the diet plan with the doctor and ensure that exercise is involved. Aim to reduce weight slowly by increasing the amount of exercise and reducing the calorie intake. • Healthy consumption – Ensure that you eat a variety of fruits and vegetables regularly."
Gastroenterology,https://www.maxhealthcare.in/our-specialities/gastroenterology/faqs,What is colonoscopy?,"The procedure involves the use of a colonoscope where the surgeon views the inner lining of large intestine in order to identify tumors, colon polyps, ulcers, internal bleeding or inflammation. The surgeon can also take samples of tissues for biopsy."
Gastroenterology,https://www.maxhealthcare.in/our-specialities/gastroenterology/faqs,Will there be a change in my diet plan after the procedure?,"After the colonoscopy, there is a possibility that you will hungry. The doctor will suggest you a diet to make you feel comfortable after the procedure. You need to have: • A lot of fluids because you will be dehydrated post colonoscopy. Fluids can be energy drinks or other carbonated drinks that will make you feel hydrated and gain electrolytes. • Light Foods- Foods which are light on the stomach, easy to chew should be consumed until the time the sedative wears off. If you consume heavy foods it will lead to vomiting or make you feel nauseated. • Low residue diet – Your colorectal surgeon will advise you to have a low residue diet like a fibre diet that will not cause irritation in the colon area."
Gastroenterology,https://www.maxhealthcare.in/our-specialities/gastroenterology/faqs,Can colon cancer be genetically inherited?,"Yes, colon cancer can be genetically inherited. About 5-10 percent of all colon cancers are inherited genetically. There are 2 major subtype of hereditary colon cancer. • Familial Adenomatous Polyposis (FAP) – This type of cancer consists of many precancerous polyps. • Lynch Syndrome or Hereditary Nonpolyposis Colorectal Cancer (HNPCC) – This is the most common form of colon cancer. Although not everyone who inherits the HNPCC gene will develop colorectal cancer. Moreover, they have a higher risk of developing other form of cancers such as kidney, ovarian, uterine, renal, pelvis, small intestine or stomach cancer."
Gastroenterology,https://www.maxhealthcare.in/our-specialities/gastroenterology/faqs,What are the procedures offered for treating colon cancer?,"The treatment of colon varies based on the severity of the cancer its stage. • Stage 1 cancer – This is the stage where the cancer has grown into the layers of the colon wall but has not spread outside the wall. The treatment for this can be done through colonoscopy itself or surgical intervention may be needed if the cancer in the polyp is high grade. • Stage 2 cancer – This is the stage where the cancer has grown beyond the colon wall and into nearby tissues but not the lymph nodes. The best treatment in this stage is surgery and adjuvant chemotherapy. • Stage 3 Cancer – This is the stage where the cancer has spread to the lymph nodes apart from the colon wall. The best treatment would be surgery to remove the affected area along with the lymph nodes followed by adjuvant chemotherapy. Radiation therapy may be an option available for people who aren’t fit for surgery. • Stage 4 Cancer – This is the stage where the cancer has spread to distant organ and tissues. It usually spreads to the liver but it can also spread to other areas. Surgical intervention may not help, however, if there are few areas where the cancer has spread then surgery may help increase chances of survival or even cure. In this stage, if surgery does not help then chemotherapy is the best alternative."
Gastroenterology,https://www.maxhealthcare.in/our-specialities/gastroenterology/faqs,Will gluten free products help reduce celiac disease?,"Celiac disease refers to a situation where a person is permanently intolerant to gluten. Gluten is a protein mainly found in wheat, barley, oat and rye. If a person suffering from celiac disease consumes gluten food then it will damage the small bowel, leading to reduced absorption of nutrients, and thereby causing weight loss, anaemia and fatigue. There is no permanent cure but the best way to reduce the chances of the disease would be consume gluten free products."
Gastroenterology,https://www.maxhealthcare.in/our-specialities/gastroenterology/faqs,How can I diagnose Peptic Ulcer disease?,"Peptic Ulcers are open sores that develop on the lining of the stomach or upper portion of the intestine. The most common symptom would be the stomach pain. However, there are other ways of determining this disease. • Tests for H. Pylori – Helicobacter Pylori bacteria(H. Pylori) is the most common source for the cause of ulcers. The doctor tests for the level of the bacteria present in your body. The best way to test this is by taking a breath test where the surgeon will ask you to consume items containing radioactive carbon. Then you will be required to blow into a bag which is sealed. If you’re infected with H.Pylori then your breath will contain radioactive carbon in the form of carbon dioxide. • Endoscopy – During endoscopy, the doctor will pass a thin, flexible pipe through the throat to search for ulcers. If ulcers are detected then tissue samples maybe collected and action will be taken accordingly."
Gastroenterology,https://www.maxhealthcare.in/our-specialities/gastroenterology/faqs,How can esophageal cancer be diagnosed?,"There are various tests used to diagnose esophageal cancer. • Barium swallow – Also called esophagram, the patient swallows liquid containing barium and then conducts an X – Ray. The barium covers the affected area which is visible through an X-ray and then an endoscopy is done to check whether it is cancerous or not. • Upper endoscopy – Also called esophagus gastric duodenoscopy, where a thin flexible tube is passed through the throat while the patient is sedated. If there is any suspicious growth of cells, a biopsy is done to check whether it is cancerous or not. • Endoscopic Ultrasound – It is often done at the time of endoscopy. The sound waves is used to determine how deep the cancer has grown and whether it has grown into nearby lymph nodes or tissues. • Bronchoscopy – similar to endoscopy, this is done if the cancer is located in the upper part of the esophagus or if the tumor is growing in the person’s windpipe. • CT Scan – A CT scan helps gives a 3D picture of the inside of the body by providing a cross section computerized view of the affected area. This method also helps in determining the size of the tumor as well."
Gastroenterology,https://www.maxhealthcare.in/our-specialities/gastroenterology/faqs,Is there a permanent cure for esophagel cancer?,"The treatment for esophageal cancer depends on the several factors, from the severity of the cancer (type and stage), possible side effects, and patients’ preference and overall health. For cancers which have not spread, doctors advise to combine multiple treatments like radiation therapy, chemotherapy and surgery. The order of treatment varies and several factors are considered, including type of esophageal cancer."
Gastroenterology,https://www.maxhealthcare.in/our-specialities/gastroenterology/faqs,Will there be any long term side effects of the treatment?,There are no particular long term side effects as such for esophageal cancer. The affected area might be permanently tanned but this is not harmful. You will experience fatigue and breathing problems in the early stages but that will improve eventually.
Gastroenterology,https://www.maxhealthcare.in/our-specialities/gastroenterology/faqs,Will there be a change in diet post-surgery?,"Yes, there will be change in diet and the exact diet plan will depend from person to person. A basic diet plan can be: • Consuming soft/moist food • Small, nutrient dense meals and snacks regularly throughout the day • 6-8 glasses of fluids daily • Daily multivitamins consumption"
Gastroenterology,https://www.maxhealthcare.in/our-specialities/gastroenterology/faqs,How is Inflammatory Bowel Disease (IBD) diagnosed?,: Inflammatory bowel disease can be diagnosed from the following tests • Blood tests • Colonoscopy • Endoscopy • X-Ray • CT Scan • MRI
